{
  "$schema": "https://json-schema.org/draft/2020-12/schema",
  "$id": "https://example.local/types/pubquiz-yes-no/v1/schema.json",
  "title": "Pubquiz yes/no v1",
  "description": "Snelle ja/nee pubquiz: vragen worden willekeurig gekozen en de student beantwoordt een ingesteld aantal vragen binnen een tijdslimiet.",
  "supportsCompletion": true,
  "outputs": [],
  "type": "object",
  "required": ["title", "questions"],
  "additionalProperties": false,
  "properties": {
    "cooldownSeconds": {
      "title": "Wachttijd tussen pogingen (seconden)",
      "description": "Wachttijd na een antwoordcontrole of volledige quiz, ook na succes. Tijdens de afteller zijn een nieuwe controle en herstart geblokkeerd. Bij 0 of weglaten blijft het bestaande gedrag behouden.",
      "type": "integer",
      "minimum": 0,
      "maximum": 86400,
      "default": 0
    },
    "title": {
      "type": "string",
      "title": "Titel",
      "description": "Titel die boven de pubquiz wordt getoond."
    },
    "rollerSeconds": {
      "type": "number",
      "title": "Rollerduur (seconden)",
      "description": "Hoe lang de tool willekeurig door vragen rolt voordat er een vraag gekozen wordt.",
      "default": 4,
      "minimum": 1
    },
    "questionSeconds": {
      "type": "number",
      "title": "Antwoordtijd (seconden)",
      "description": "Hoeveel seconden de student heeft om ja/nee te antwoorden.",
      "default": 10,
      "minimum": 3
    },
    "questionsToAsk": {
      "type": "number",
      "title": "Aantal te stellen vragen",
      "description": "Hoeveel vragen er in een poging worden gesteld.",
      "default": 1,
      "minimum": 1
    },
    "minCorrectToPass": {
      "type": "number",
      "title": "Minimaal aantal goede antwoorden",
      "description": "Minimale score die nodig is om het certificaat te behalen.",
      "default": 1,
      "minimum": 1
    },
    "questions": {
      "type": "array",
      "title": "Vragen",
      "description": "Lijst met ja/nee vragen waaruit willekeurig gekozen wordt.",
      "minItems": 2,
      "items": {
        "type": "object",
        "title": "Vraag",
        "required": ["question", "answer"],
        "additionalProperties": false,
        "properties": {
          "question": {
            "type": "string",
            "title": "Vraag",
            "description": "De vraagtekst die op het scherm komt."
          },
          "answer": {
            "type": "boolean",
            "title": "Correct antwoord",
            "description": "Aan = Ja, uit = Nee."
          }
        }
      }
    }
  }
}
