{
  "title": "Pubquiz: Ja of Nee?",
  "rollerSeconds": 4,
  "questionSeconds": 8,
  "questionsToAsk": 4,
  "minCorrectToPass": 3,
  "questions": [
    { "question": "De Eiffeltoren staat in Parijs", "answer": true },
    { "question": "De Sahara is het grootste regenwoud ter wereld", "answer": false },
    { "question": "Water kookt bij 100 graden Celsius", "answer": true },
    { "question": "Een octopus heeft 3 harten", "answer": true },
    { "question": "Canberra is de hoofdstad van Australie", "answer": true }
  ]
}
